University of Southern California Marshall;North America;university of southern california marshall;university of southern california marshall school of business ranking;university of southern california marshall (usc marshall);university of southern california marshall mba fees;university of southern california marshall address;university of southern california marshall school of business logo;university of southern california marshall school of business acceptance rate;university of southern california marshall acceptance rate;usc marshall requirements;usc marshall gpa requirements
University of St Gallen;Europe;university of st gallen;university of st gallen ranking;university of st gallen acceptance rate;university of st gallen mba;university of st gallen mim;university of st gallen fees;university of st gallen scholarship;university of st gallen mba fees;university of st gallen world ranking;university of st gallen masters
University of Strathclyde Business School;Europe;university of strathclyde business school;university of strathclyde business school ranking;university of strathclyde business school- uae;university of strathclyde business school address;university of strathclyde business school logo;university of strathclyde business school dubai;university of strathclyde business school mba fees;university of strathclyde business school mba;university of strathclyde business school - dubai campus;is strathclyde business school good
University of Texas at Austin McCombs;North America;university of texas at austin mccombs;university of texas at austin mccombs acceptance rate;university of texas at austin mba;university of texas at austin mba fees;university of texas at austin mba program;university of texas at austin mba requirements;university of texas at austin mba acceptance rate;university of texas at austin mba ranking;university of texas at austin mba deadlines;university of texas at austin mba admissions
University of Texas at Dallas Jindal;North America;university of texas at dallas jindal;university of texas at dallas jindal mba;university of texas--dallas (naveen jindal) online mba;university of texas--dallas (naveen jindal) rankings;does ut dallas have a law school;what gpa is required for ut dallas;is ut dallas a good business school;how large is university of texas;;
University of Toronto Rotman;North America;university of toronto rotman;university of toronto rotman commerce;university of toronto rotman acceptance rate;university of toronto rotman mba;university of toronto rotman school of management ranking;university of toronto rotman school of management acceptance rate;university of toronto rotman commerce tuition fees;university of toronto rotman fees;university of toronto rotman admission requirements;university of toronto rotman undergraduate
University of Virginia Darden;North America;university of virginia darden school of business;university of virginia darden school of business ranking;university of virginia darden school foundation;university of virginia darden mba;university of virginia darden acceptance rate;university of virginia darden school;university of virginia darden school of business mba fees;university of virginia darden executive education;university of virginia darden mba ranking;university of virginia darden online mba
University of Washington Michael G Foster;North America;university of washington michael g foster;;;;;;;;;
Vanderbilt University Owen;North America;vanderbilt university owen graduate school of management;vanderbilt university owen mba;vanderbilt university act range;vanderbilt university application deadline;vanderbilt university sat scores;;;;;
Vlerick Business School;Europe;vlerick business school;vlerick business school ranking;vlerick business school brussels;vlerick business school mba fees;vlerick business school leuven;vlerick business school fees;vlerick business school photos;vlerick business school acceptance rate;vlerick business school online mba;vlerick business school tuition fees
Wake Forest University Babcock;North America;wake forest university babcock hall;where is wake forest university located;is wake forest university prestigious;what is wake forest university known for;banks near wake forest university;;;;;
Warwick Business School;Europe;warwick business school;warwick business school ranking;warwick business school acceptance rate;warwick business school mba;warwick business school mba fees;warwick business school online mba;warwick business school photos;warwick business school qs ranking;warwick business school address;warwick business school mim
Washington University Olin;North America;washington university olin;washington university olin business school ranking;washington university olin library;washington university olin mba;washington university olin business school acceptance rate;washington university olin business school faculty;washington university olin library catalog;washington university olin dean;washington u olin;
Western University Ivey;North America;western university ivey;western university ivey business school ranking;western university ivey acceptance rate;western university ivey business school acceptance rate;western university ivey mba;western university ivey business school tuition fee;western university ivey aeo;western university ivey master of business analytics;western university ivey dual degree;western university ivey mba fees
WHU – Otto Beisheim School of Management;Europe;;;;;;;;;;
William & Mary Mason;North America;william & mary mason school of business;william and mary mason school of business ranking;;;;;;;;
Wisconsin School of Business;North America;wisconsin school of business;wisconsin school of business ranking;wisconsin school of business acceptance rate;wisconsin school of business study abroad;wisconsin school of business majors;wisconsin school of business photos;wisconsin school of business logo;wisconsin school of business qs ranking;wisconsin school of business business analytics;wisconsin school of business mba
Yale School of Management;North America;yale school of management;yale school of management acceptance rate;yale school of management ranking;yale school of management executive education;yale school of management mba fees;yale school of management women's leadership program;yale school of management mba;yale school of management courses;yale school of management logo;yale school of management address
York University Schulich;Europe;york university schulich school of business;york university schulich school of business ranking;york university schulich requirements;york university schulich master of business analytics;york university schulich mba;york university schulich ranking;york university schulich school of business fees;york university schulich campus;york university schulich tuition;york university schulich school of business acceptance rate
