name;region;sug1;sug2;sug3;sug4;sug5;sug6;sug7;sug8;sug9;sug10
AGSM at UNSW Business School;North America;agsm at unsw business school;is agsm mba worth it;does university of alabama have a good business school;;;;;;;
Alberta School of Business;North America;alberta school of business;alberta school of business mba fees;alberta school of business ranking;alberta school of business mba requirements;alberta school of business mba;alberta school of business acceptance rate;alberta school of business mba fees for international students;alberta school of business fees;alberta school of business scholarships;alberta school of business masters in finance
Alliance Manchester Business School;Europe;alliance manchester business school;alliance manchester business school ranking;alliance manchester business school photos;alliance manchester business school acceptance rate;alliance manchester business school mba fees;alliance manchester business school address;alliance manchester business school fees;alliance manchester business school reviews;alliance manchester business school dubai;alliance manchester business school online mba
Arizona State University WP Carey;North America;arizona state university wp carey;arizona state university wp carey acceptance rate;arizona state university wp carey/snai emba;arizona state university wp carey mba;arizona state university wp carey ranking;asu wp carey requirements;asu wp carey acceptance rate;;;
Audencia;Europe;audencia business school;audencia;audencia nantes;audiencias tv;audencia tomorrow;audiencia nacional;audiencia grand prix;audiencias asi es la vida;audiencia;audiencias telecinco
Babson College Olin;North America;babson college olin;babson college olin mba;babson college olin hall;babson college (olin) (ma);is olin college part of babson;babson college requirements;babson college benefits;babson college history;;
Bayes Business School formerly Cass;Europe;bayes business school (formerly cass);bayes (formerly called cass) business school dubai international financial centre;bayes business school ranking;asian school of business bba fees;;;;;;
Birmingham Business School;Europe;birmingham business school;birmingham business school ranking;birmingham business school mba;birmingham business school acceptance rate;birmingham business school photos;birmingham business school qs ranking;birmingham business school staff;birmingham business school dubai;birmingham business school address;birmingham business school dean
Boston College Carroll;North America;boston college carroll school of management;boston college carroll school of management acceptance rate;boston college carroll school of management ranking;boston college carroll acceptance rate;boston college carroll mba;boston college carroll school of management undergraduate acceptance rate;boston college carroll school of management majors;boston college carroll school acceptance rate;boston college carroll school of management faculty;boston college carroll graduate school of management
Boston University Questrom School of Business;North America;boston university questrom school of business;boston university questrom school of business ranking;boston university questrom school of business behavioral lab;boston university questrom school of business online mba;boston university questrom school of business news;boston university questrom school of business undergraduate;boston university questrom school of business acceptance rate;boston university questrom school of business mba;boston university questrom school of business undergraduate acceptance rate;boston university questrom school of business faculty
Brigham Young University Marriott;North America;brigham young university marriott school of business;brigham young university marriott center;brigham young university (marriott) mba;brigham young university marriott school;brigham young university address and phone number;brigham young university mba fees;brigham young university mailing address;can anyone go to brigham young university;;
Carnegie Mellon Tepper;North America;carnegie mellon tepper;carnegie mellon tepper mba;carnegie mellon tepper online mba;carnegie mellon tepper ranking;carnegie mellon tepper acceptance rate;carnegie mellon tepper mba class profile;carnegie mellon tepper academic calendar;carnegie mellon tepper building;carnegie mellon tepper reddit;carnegie mellon tepper mba ranking
Case Western Reserve University Weatherhead School of Management;North America;case western reserve university weatherhead school of management;case western reserve university weatherhead school of management ranking;;;;;;;;
Ceibs;Asia;ceibs;ceibs mba;ceibs ghana;ceibs ranking;ceibs mba fees;ceibs emba;ceibs switzerland;ceibs africa;ceibs nigeria;ceibs logo
City University of Hong Kong;Asia;city university of hong kong;city university of hong kong ranking;city university of hong kong address;city university of hong kong acceptance rate;city university of hong kong world ranking;city university of hong kong photos;city university of hong kong career;city university of hong kong scholarship;city university of hong kong logo;city university of hong kong library
Columbia Business School;North America;columbia business school;columbia business school mba;columbia business school online;columbia business school acceptance rate;columbia business school ranking;columbia business school mba fees;columbia business school executive education;columbia business school application;columbia business school academic calendar;columbia business school course catalog
Copenhagen Business School;Europe;copenhagen business school;copenhagen business school ranking;copenhagen business school acceptance rate;copenhagen business school mba;copenhagen business school fees;copenhagen business school mba fees;copenhagen business school photos;copenhagen business school masters;copenhagen business school logo;copenhagen business school phd
Coppead;South America;coppead;coppead ufrj;coppead graduate school of business;coppead mba;coppead alumni;coppead mestrado;coppead/ufrj;coppead institute of administration;coppead ufrj mba;copperhead road
Cornell University Johnson;North America;cornell university johnson;cornell university johnson mba;cornell university johnson museum;cornell university johnson mba fees;cornell university johnson mba class profile;cornell university johnson acceptance rate;cornell university (johnson) business school overview;cornell johnson college;cornell university johnson/queen's university smith;johnson cornell university ranking
Cranfield School of Management;Europe;cranfield school of management;cranfield school of management ranking;cranfield school of management qs ranking;cranfield school of management mba;cranfield school of management acceptance rate;cranfield school of management mba fees;cranfield school of management photos;cranfield school of management world ranking;cranfield school of management logo;cranfield school of management mim
CUHK Business School;Asia;cuhk business school;cuhk business school ranking;cuhk business school dean;cuhk business school address;cuhk business school calculator;cuhk business school alumni;cuhk business school scholarship;cuhk business school interview;cuhk business school town centre;cuhk business school exchange
Dartmouth College Tuck;North America;dartmouth college tuck;dartmouth college tuck mba;dartmouth college tuck acceptance rate;dartmouth college tucker foundation;dartmouth college tuck school of business ranking;dartmouth college tuck school;dartmouth college tuck mba admissions;dartmouth college tuck application deadline;trustees of dartmouth college tuck annual giving;dartmouth tuck application deadline
Duke University's Fuqua School of Business;North America;duke university's fuqua school of business;duke university fuqua school of business ranking;duke university fuqua school of business acceptance rate;duke university fuqua school of business fees;duke university fuqua school of business dubai;duke university fuqua school of business grading scale;duke university - the fuqua school of business staff directory;duke university fuqua school of business master of management studies;does duke have a business school;is fuqua a good business school
Durham University Business School;Europe;durham university business school;durham university business school ranking;durham university business school mba;durham university business school online mba;durham university business school address;durham university business school mba fees;durham university business school photos;durham university business school qs ranking;durham university business school staff;durham university business school logo
Eada Business School Barcelona;Europe;;;;;;;;;;
Edhec Business School;Europe;edhec business school;edhec business school ranking;edhec business school nice;edhec business school lille;edhec business school acceptance rate;edhec business school fees;edhec business school photos;edhec business school paris;edhec business school mba fees;edhec business school mba
EMLyon Business School;Europe;emlyon business school;emlyon business school ranking;emlyon business school paris;emlyon business school acceptance rate;emlyon business school fees;emlyon business school photos;emlyon business school reviews;emlyon business school mim;emlyon business school mba fees;emlyon business school mba
Emory University Goizueta;North America;emory university goizueta business school;emory university goizueta business school ranking;emory university goizueta business school acceptance rate;emory university goizueta business school requirements;emory university (goizueta) mba;emory university goizueta business school undergraduate;emory university goizueta business school dean;emory university goizueta business;emory university goizueta mba curriculum;emory university goizueta scholarship
Esade Business School;Europe;esade business school;esade business school ranking;esade business school madrid;esade business school acceptance rate;esade business school fees;esade business school campus;esade business school jobs;esade business school mba;esade business school qs ranking;esade business school mba fees
ESCP Business School;Europe;escp business school;escp business school madrid;escp business school london;escp business school logo;escp business school ranking;escp business school acceptance rate;escp business school fees;escp business school berlin;escp business school photos;escp business school mba
ESMT Berlin;Europe;esmt berlin;esmt berlin ranking;esmt berlin mba fees;esmt berlin mba;esmt berlin acceptance rate;esmt berlin mim;esmt berlin qs ranking;esmt berlin mba requirements;esmt berlin online mba;esmt berlin world ranking
Essec Business School;Europe;essec business school;essec business school ranking;essec business school singapore;essec business school fees;essec business school photos;essec business school acceptance rate;essec business school mim;essec business school mba;essec business school reviews;essec business school address
Fordham University Gabelli;North America;fordham university gabelli school of business;fordham university gabelli school of business ranking;fordham university gabelli school of business acceptance rate;fordham university gabelli school of business rose hill;fordham university gabelli school of business academic calendar;fordham university gabelli school of business lincoln center;fordham university gabelli school of business graduation 2023;fordham university gabelli school of business logo;fordham university requirements;fordham university application deadline
Frankfurt School of Finance and Management;Europe;frankfurt school of finance and management;frankfurt school of finance and management ranking;frankfurt school of finance and management acceptance rate;frankfurt school of finance and management fees;frankfurt school of finance and management mba;frankfurt school of finance and management qs ranking;frankfurt school of finance and management mim;frankfurt school of finance and management world ranking;frankfurt school of finance and management mba placements;frankfurt school of finance and management average salary
Fudan University School of Management;Asia;fudan university school of management;fudan university school of management ranking;fudan university school of management mba;fudan university mba requirements;is fudan university a good school;does fudan university teach in english;what is fudan university known for;;;
George Washington University;North America;george washington university;george washington university ranking;george washington university hospital;george washington university acceptance rate;george washington university law school;george washington university tuition;george washington university mascot;george washington university cost;george washington university medical school;george washington university school of medicine
Georgetown University McDonough;North America;georgetown university mcdonough school of business;georgetown university mcdonough school of business ranking;georgetown university mcdonough school of business acceptance rate;georgetown university mcdonough school of business undergraduate acceptance rate;georgetown university mcdonough school of business logo;georgetown university mcdonough arena;georgetown university mcdonough mba;georgetown university mcdonough school of business tuition;georgetown university mcdonough school of business mba;georgetown university mcdonough school of business undergraduate
Georgia Tech Scheller College of Business;North America;georgia tech scheller college of business;georgia tech scheller college of business ranking;georgia tech scheller college of business acceptance rate;georgia tech scheller college of business mba;georgia tech scheller college of business - quantitative & computational finance;georgia tech scheller college of business dean‚Äôs scholarship;georgia tech scheller college of business majors;georgia tech - scheller college of business - mba program;does georgia tech have a business school;is georgia tech a good business school
Grenoble Ecole de Management;Europe;grenoble ecole de management;grenoble ecole de management ranking;grenoble ecole de management paris;grenoble ecole de management fees;grenoble ecole de management photos;grenoble ecole de management acceptance rate;grenoble ecole de management qs ranking;grenoble ecole de management france;grenoble ecole de management singapore;grenoble ecole de management reviews
Harvard Business School;North America;harvard business school;harvard business school online;harvard business school publishing;harvard business school online courses;harvard business school mba;harvard business school acceptance rate;harvard business school online free courses;harvard business school fees;harvard business school case studies;harvard business school executive education
HEC Paris;Europe;hec paris;hec paris ranking;hec paris mba;hec paris mba price;hec paris acceptance rate;hec paris masters;hec paris phd;hec paris logo;hec paris campus;hec paris portal
HKU Business School;Asia;hku business school;hku business school ranking;hku business school career portal;hku business school exchange;hku business school courses;hku business school faculty;hku business school interview;hku business school phd;hku business school address;hku business school acceptance rate
HKUST Business School;Asia;hkust business school;hkust business school ranking;hkust business school central;hkust business school faculty;hkust business school exchange;hkust business school qs ranking;hkust business school mba;hkust business school acceptance rate;hkust business school dean;hkust business school interview
Hult International Business School;Europe;hult international business school;hult international business school ranking;hult international business school london;hult international business school boston;hult international business school dubai;hult international business school acceptance rate;hult international business school san francisco;hult international business school fees;hult international business school location;hult international business school uk
IE Business School;Europe;ie business school;ie business school ranking;ie business school precio;ie business school mba fees;ie business school fees;ie business school logo;ie business school acceptance rate;ie business school ranking 2023;ie business school dean;ie business school courses
Iese Business School;Europe;iese business school;iese business school address;iese business school ranking;iese business school madrid;iese business school jobs;iese business school fees;iese business school precio;iese business school logo;iese business school acceptance rate;iese business school mba
Imperial College Business School;Europe;imperial college business school;imperial college business school ranking;imperial college business school acceptance rate;imperial college business school mba;imperial college business school mba fees;imperial college business school logo;imperial college business school fees;imperial college business school online mba;imperial college business school executive education;imperial college business school address
Incae Business School;South America;incae business school;incae business school ranking;incae business school photos;incae business school mba;incae business school logo;incae business school panama;incae business school of costa rica;incae business school nicaragua;incae business school mba fees;
Indian Institute of Management Ahmedabad;Asia;indian institute of management ahmedabad;indian institute of management ahmedabad notable alumni;indian institute of management ahmedabad rankings;indian institute of management ahmedabad fees;indian institute of management ahmedabad news;indian institute of management ahmedabad mba fees;indian institute of management ahmedabad course admissions fees;indian institute of management ahmedabad average package;indian institute of management ahmedabad address;indian institute of management ahmedabad cut off
Indian Institute of Management Bangalore;Asia;indian institute of management bangalore;indian institute of management bangalore photos;indian institute of management bangalore fees;indian institute of management bangalore reviews;indian institute of management bangalore notable alumni;indian institute of management bangalore mba fees;indian institute of management bangalore rankings;indian institute of management bangalore fee structure;indian institute of management bangalore address;indian institute of management bangalore bba fees
Indian Institute of Management Calcutta;Asia;indian institute of management calcutta rankings;indian institute of management calcutta;indian institute of management calcutta course admissions;indian institute of management calcutta notable alumni;indian institute of management calcutta fees;indian institute of management calcutta rankings nirf;indian institute of management calcutta course admissions fees;indian institute of management calcutta address;indian institute of management calcutta courses;indian institute of management calcutta cut off
Indian Institute of Management Indore;Asia;indian institute of management indore;indian institute of management indore course admissions;indian institute of management indore rankings;indian institute of management indore notable alumni;indian institute of management indore fees;indian institute of management indore mba fees;indian institute of management indore bba fees;indian institute of management indore fees structure;indian institute of management indore placement;indian institute of management indore average package
Indian Institute of Management Lucknow;Asia;indian institute of management lucknow;indian institute of management lucknow rankings;indian institute of management lucknow notable alumni;indian institute of management lucknow fees;indian institute of management lucknow course admissions fees;indian institute of management lucknow noida campus;indian institute of management lucknow placement;indian institute of management lucknow cutoff;indian institute of management lucknow address;indian institute of management lucknow bba fees
Indian School of Business;Asia;indian school of business;indian school of business and finance;indian school of business management and administration;indian school of business fees;indian school of business mohali;indian school of business ranking;indian school of business notable alumni;indian school of business hyderabad address;indian school of business bangalore;indian school of business placements
Indiana University Kelley;North America;indiana university kelley school of business;indiana university kelley acceptance rate;indiana university kelley school of business ranking;indiana university kelley study abroad;indiana university kelley mba;indiana university kelley school of business online mba;indiana university kelley school of business logo;indiana university kelley school of business tuition;indiana university kelley undergraduate acceptance rate;indiana university kelley school of business admissions
Insead;Europe;insead;insead mba;insead singapore;insead mba fees;insead executive mba;insead mba price;insead executive education;insead logo;insead ranking;insead mim
International Institute for Management Development IMD;Europe;international institute for management development imd;international institute for management development (imd) world competitiveness ranking;international institute for management development (imd) switzerland;international institute for management development(imd) world talent ranking;international institute for management development (imd) mba;international institute for management development (imd) world competitiveness ranking 2023;international institute for management development (imd) world competitiveness ranking 2022;international institute for management development (imd) world competitiveness ranking 2020;the international institute for management development (imd) is an independent academic institution;international institute for management development ranking
Ipade Business School;South America;ipade business school;ipade business school ranking;ipade business school logo;ipade business school monterrey;ipade business school mexico;ipade business school mba fees;ipade business school universidad panamericana;ipade business school wikipedia;ipade business school wiki;ipade business school exchange
Korea University Business School;Asia;korea university business school;korea university business school ranking;korea university business school fees;korea university business school international students;korea university business school (kubs);korea university business school photos;korea university business school undergraduate courses;korea university business school exchange;korea university business school scholarship;korea university business school faculty
Lancaster University Management School;Europe;lancaster university management school;lancaster university management school ranking;lancaster university management school qs ranking;lancaster university management school photos;lancaster university management school acceptance rate;lancaster university management school mba;lancaster university management school staff;lancaster university management school world ranking;lancaster university management school logo;lancaster university management school mba fees
Leeds University Business School;Europe;leeds university business school;leeds university business school ranking;leeds university business school scholarships;leeds university business school photos;leeds university business school acceptance rate;leeds university business school qs ranking;leeds university business school address;leeds university business school mba;leeds university business school mba fees;leeds university business school reviews
London Business School;Europe;london business school;london business school acceptance rate;london business school mba;london business school ranking;london business school mba fees;london business school undergraduate;london business school online;london business school ib requirements;london business school entry requirements;london business school summer school
Macquarie Business School;Asia;macquarie business school;macquarie business school ranking;macquarie business school qs ranking;macquarie business school mba;macquarie business school address;macquarie business school mba fees;macquarie business school logo;macquarie business school reviews;macquarie business school city campus;macquarie business school dean
Mannheim Business School;Europe;mannheim business school;mannheim business school mba fees;mannheim business school ranking;mannheim business school mba;mannheim business school acceptance rate;mannheim business school ggmbh;mannheim business school public or private;mannheim business school mba requirements;mannheim business school mba fees for indian students;mannheim business school gmat score
McGill University Desautels;North America;mcgill university desautels;mcgill university desautels master of management in finance;mcgill university desautels faculty of management requirements;mcgill university desautels faculty of management ranking;mcgill desautels core courses;mcgill university size;mcgill desautels admission requirements;is mcgill desautels good;;
