Melbourne Business School;North America;melbourne business school;melbourne business school mba fees;melbourne business school ranking;melbourne business school online;melbourne business school short courses;melbourne business school acceptance rate;melbourne business school scholarships;melbourne business school photos;melbourne business school placements;melbourne business school world ranking
Miami Herbert Business School;North America;miami herbert business school;miami herbert business school ranking;miami herbert business school photos;miami herbert business school acceptance rate;miami herbert business school tuition;miami herbert business school requirements;miami herbert business school reviews;miami herbert business school logo;miami herbert business school dean;miami herbert business school mba
Michigan State University Broad;North America;michigan state university broad college of business;michigan state university broad mba;michigan state university broad art museum;michigan state university broad college of business ranking;michigan state university broadcastify;michigan state university broad museum;michigan state university broad college of business application;michigan state university broadcast journalism;michigan state university broad school;michigan state university broad college
MIT Sloan;North America;mit sloan;mit sloan management review;mit sloan executive education;mit sloan mba;mit sloan fellows;mit sloan xr;mit sloan academic calendar;mit sloan acceptance rate;mit sloan degrees;mit sloan degrees nyt
Nanyang Business School NTU Singapore;Asia;nanyang business school ntu singapore;nanyang business school ntu singapore mba;is nanyang business school good;nanyang business school courses;nanyang business school admission requirements;;;;;
National University of Singapore Business School;Asia;national university of singapore business school;national university of singapore business school ranking;national university of singapore business school mba fees;national university of singapore business school fees;national university of singapore business school mba;national university of singapore business school faculty;national university of singapore business school address;national university of singapore business school dean;national university of singapore graduate school;national university of singapore business administration
New York University Stern;North America;new york university stern school of business;new york university stern school of business reviews;new york university stern school of business fees;new york university stern acceptance rate;new york university stern school of business notable alumni;new york university stern mba;new york university stern address;new york university stern school of business mba;new york university stern center for sustainable business;new york university stern school of business cost
Northeastern University D'Amore-McKim;North America;northeastern university d'amore-mckim school of business;northeastern university d'amore-mckim school of business acceptance rate;northeastern university d'amore mckim admissions;northeastern d'amore mckim acceptance rate;;;;;;
Northwestern University Kellogg School of Management;North America;northwestern university kellogg school of management;northwestern university kellogg school of management ranking;northwestern university kellogg school of management mba;northwestern university kellogg school of management executive education;northwestern university kellogg school of management online mba;northwestern university - kellogg school of management staff directory;kellogg school of management northwestern university the family office leadership program;northwestern university kellogg executive mba cost;kellogg school of management world ranking;does northwestern have a good business school
Ohio State University Fisher;North America;ohio state university fisher college of business;ohio state university fisher college of business ranking;ohio state university fisher college of business acceptance rate;ohio state university fisher college;ohio state university fisher college of business admissions;ohio state university fisher mba;ohio state university fisher acceptance rate;ohio state university fisher college of business career services;ohio state university fisher school;the ohio state university fisher college of business staff directory
Peking University Guanghua School of Management;Asia;peking university guanghua school of management;peking university guanghua school of management ranking;peking university mba ranking;peking university business school ranking;peking university mba fees;is peking university good;is peking university the same as beijing university;;;
Pennsylvania State University Smeal;North America;pennsylvania state university smeal;pennsylvania state university smeal mba;penn state smeal requirements;penn state smeal gpa requirements;penn state smeal average salary;;;;;
Politecnico di Milano School of Management;Europe;politecnico di milano school of management;politecnico di milano school of management online mba;politecnico di milano school of management ranking;politecnico di milano school of management international flex mba;politecnico di milano school of management fees;politecnico di milano school of management master;politecnico di milano department of management economics and industrial engineering;mip politecnico di milano school of management;politecnico di milano graduate school of management;mip politecnico di milano school of management- neoma business school
Purdue University Krannert;North America;purdue university krannert school of management;purdue university krannert school of management ranking;purdue university krannert school of management acceptance rate;purdue university (krannert graduate school of management);purdue university krannert school of management faculty;purdue university krannert school of management west lafayette in;purdue university krannert scholarships;purdue university krannert majors;purdue university krannert concentration;purdue university krannert requirements
Queen's University Smith;North America;queen's university smith school of business;queen's university smith school of business ranking;queen's university smith mba;queen's university smith house;queen's university smith school of business tuition;steven smith queen's university;cornell university johnson/queen's university smith;is queen's university prestigious;queen's university world ranking;
Renmin University of China Business School RMBS;Asia;renmin university of china business school;renmin university of china mba;renmin business school ranking;renmin business school;renmin university business school;;;;;
Rice University Jones;North America;rice university jones;rice university jones college;rice university jones mba;rice university jones business school;rice university jones college dorms;rice university (jones) online mba;rice university mark jones;is rice university prestigious;what is rice university known for;rice university rice box examples
Rotterdam School of Management Erasmus University;Europe;rotterdam school of management erasmus university;rotterdam school of management erasmus university ranking;rotterdam school of management erasmus university mim;rotterdam school of management erasmus university acceptance rate;rotterdam school of management erasmus university mba;rotterdam school of management erasmus university phd;rotterdam school of management erasmus university mba fees;rotterdam school of management erasmus university world ranking;rotterdam school of management erasmus university msc international management;rotterdam school of management erasmus university rotterdam netherlands
Rutgers Business School;North America;rutgers business school;rutgers business school ranking;rutgers business school acceptance rate;rutgers business school majors;rutgers business school photos;rutgers business school requirements;rutgers business school commencement 2023;rutgers business school transfer requirements;rutgers business school tuition;rutgers business school logo
SDA Bocconi School of Management;Europe;sda bocconi school of management;sda bocconi school of management photos;sda bocconi school of management mumbai;sda bocconi school of management ranking;sda bocconi school of management mba fees;sda bocconi school of management fees;sda bocconi school of management mba;sda bocconi school of management reviews;sda bocconi school of management qs ranking;sda bocconi school of management acceptance rate
Shanghai Jiao Tong University Antai;Asia;shanghai jiao tong university antai college of economics & management;shanghai jiao tong university antai global summer school;is shanghai jiao tong university good;shanghai jiao tong university requirements;shanghai jiao tong university mba requirements;shanghai jiao tong university application deadline;shanghai jiao tong university courses;;;
Shanghai University of Finance and Economics College of Business;Asia;shanghai university of finance and economics college of business;;;;;;;;;
Singapore Management University Lee Kong Chian;Asia;singapore management university lee kong chian;lee kong chian museum review;lee kong chian museum opening hours;lee kong chian school of medicine address;lee kong chian natural history museum opening hours;lee kong chian natural history museum admission fee;;;;
SMU Cox;North America;smu cox;smu cox school of business ranking;smu cox mba;smu cox acceptance rate;smu cox resume template;smu cox school of business acceptance rate;smu cox academic calendar;smu cox logo;smu cox majors;smu cox faculty
Stanford Graduate School of Business;North America;stanford graduate school of business;stanford graduate school of business photos;stanford graduate school of business mba fees;stanford graduate school of business acceptance rate;stanford graduate school of business mba;stanford graduate school of business notable alumni;stanford graduate school of business reviews;stanford graduate school of business mba requirements;stanford graduate school of business ranking;stanford graduate school of business mba eligibility
Sungkyunkwan University GSB;Asia;sungkyunkwan university gsb;sungkyunkwan university gsb mba fees;sungkyunkwan university gsb mba;is sungkyunkwan university good;;;;;;
Temple University Fox;North America;temple university fox school of business;temple university fox school of business acceptance rate;temple university fox school of business ranking;temple university fox chase cancer center;temple university fox advising;temple university fox school of business tuition;temple university fox fund;temple university fox school of business faculty;temple university fox school of business graduate programs;temple university fox resume template
Texas A & M University Mays;North America;texas a & m university mays;texas a&m university mays business school;texas a&m university mays business school ranking;texas a&m university graduation may 2023;what is a texas a and m aggie;texas a&m mays business school transfer requirements;texas a and m application deadline;;;
The Lisbon MBA Catolica  Nova;Europe;;;;;;;;;;
Tias Business School Tilburg University;Europe;tias business school tilburg university;tias business school tilburg university mba;;;;;;;;
Tongji University School of Economics and Management;Asia;tongji university school of economics and management;tongji university school of economics and management ranking;zagreb school of economics and management ranking;is tongji university good;tongji university tuition fees for international students;;;;;
Trinity College Dublin Trinity Business School;Europe;trinity college dublin trinity business school;trinity college dublin - trinity business school msc in international management;trinity college dublin business school ranking;trinity college dublin business school accreditation;trinity college dublin graduate school acceptance rate;trinity college dublin graduate school;trinity business school trinity college dublin ireland;trinity college dublin opening hours;is trinity college dublin prestigious;trinity college dublin entry requirements
Tsinghua University School of Economics and Management;Asia;tsinghua university school of economics and management;tsinghua university school of economics and management ranking;tsinghua university school of economics and management advisory board;advisory board of the tsinghua university school of economics and management in beijing;is tsinghua university good for international students;is tsinghua university good;what is tsinghua university known for;does tsinghua university teach in english;;
Tulane University Freeman;North America;tulane university freeman school of business;tulane university freeman;tulane university freeman school of business ranking;what is tulane university best known for;;;;;;
UCLA Anderson School of Management;North America;ucla anderson school of management;ucla anderson school of management ranking;ucla anderson school of management mba fees;ucla anderson school of management acceptance rate;ucla anderson school of management mba;ucla anderson school of management world ranking;ucla anderson school of management reviews;ucla anderson school of management tuition;ucla anderson school of management logo;ucla anderson school of management phone number
UCT Graduate School of Business;Africa;uct graduate school of business;uct graduate school of business conference centre;uct graduate school of business vacancies;university of cape town graduate school of business ranking;university of cape town graduate school of business accreditation;university of cape town graduate school of business mba program;average gre for business schools;usc business grad school requirements;uct business school courses;
University College Dublin Smurfit;Europe;university college dublin smurfit;university college dublin smurfit mim;university college dublin smurfit mba;university college dublin smurfit ranking;is university college dublin good;what is university college dublin known for;ucd smurfit fees;ucd smurfit ranking;;
University of Bath School of Management;Europe;university of bath school of management;university of bath school of management acceptance rate;university of bath school of management ranking;university of bath school of management address;university of bath school of management building;university of bath school of management staff;university of bath school of management logo;university of bath school of management world ranking;university of bath school of management dean;university of bath school of management jobs
University of British Columbia Sauder;North America;university of british columbia sauder school of business;university of british columbia sauder school of business requirements;university of british columbia sauder school of business ranking;university of british columbia sauder mba;sauder ubc requirements;ubc sauder registration dates;ubc sauder application deadline;;;
University of California at Berkeley Haas;North America;university of california at berkeley haas;university of california at berkeley haas mba;university of california--berkeley (haas) business analytics;university of california berkeley haas acceptance rate;university of california berkeley mba fees;university of california berkeley mba requirements;university of california berkeley mba acceptance rate;university of california berkeley mba ranking;university of california berkeley mba deadline;university of california berkeley mba online
University of California at Davis;North America;university of california at davis;university of california at davis ranking;university of california at davis veterinary school;university of california at davis mba;university of california at davis medical center;university of california at davis law school;university of california at davis mathematics;university of california at davis calendar;university of california at davis philosophy;university of california at davis transfer
University of California at Irvine Merage;North America;university of california at irvine merage;university of california irvine mba;university of california irvine mba ranking;university of california irvine mba fees;university of california irvine mba requirements;university of california irvine mba cost;university of california irvine mba acceptance rate;university of california irvine mba employment report;is uc irvine a party school;
University of California at San Diego Rady;North America;university of california--san diego (rady);university of california san diego rady children's hospital;difference between san diego state and ucsd;who is rady in san diego;;;;;;
University of Cambridge Judge;Europe;university of cambridge judge business school;university of cambridge judge business school ranking;university of cambridge judge business school acceptance rate;university of cambridge judge mba;university of cambridge judge business school logo;university of cambridge judge business school executive education;university of cambridge judge business school mba;university of cambridge judge mba fees;cambridge judge fees;cambridge judge deadlines
University of Chicago Booth;North America;university of chicago booth;university of chicago booth acceptance rate;university of chicago booth mba;university of chicago booth school of business acceptance rate;university of chicago booth school of business ranking;university of chicago booth emba;university of chicago booth school of business mba fees;university of chicago booth london;university of chicago booth bookstore;university of chicago booth application
University of Connecticut School of Business;North America;university of connecticut school of business;university of connecticut school of business ranking;university of connecticut business school acceptance rate;university of connecticut business school faculty;;;;;;
University of Edinburgh Business School;Europe;university of edinburgh business school;university of edinburgh business school ranking;university of edinburgh business school acceptance rate;university of edinburgh business school address;university of edinburgh business school mba;university of edinburgh business school logo;university of edinburgh business school photos;university of edinburgh business school staff;university of edinburgh business school msc in business analytics;university of edinburgh business school mba fees
University of Florida Warrington;North America;university of florida warrington;university of florida warrington online mba;university of florida warrington mba;university of florida warrington acceptance rate;university of florida warrington ranking;university of florida warrington school of business;university of florida warrington mba fees;university of florida warrington mba acceptance rate;university of florida warrington mba requirements;university of florida warrington online mba fees
University of Georgia Terry;North America;university of georgia terry college of business;university of georgia terry mba;university of georgia terry college of business ranking;university of georgia terry school of business;university of georgia terry college;university of georgia terry college of business acceptance rate;university of georgia terry college of business logo;university of georgia terry online mba;uga terry average salary;uga terry application deadline
University of Illinois at Urbana-Champaign;North America;university of illinois at urbana-champaign;university of illinois at urbana-champaign ranking;university of illinois at urbana-champaign acceptance rate;university of illinois at urbana-champaign address;university of illinois at urbana-champaign graduate programs;university of illinois at urbana-champaign location;university of illinois at urbana-champaign tuition;university of illinois at urbana-champaign ielts requirement;university of illinois at urbana-champaign computer science;university of illinois at urbana-champaign logo
University of Iowa Tippie;North America;university of iowa tippie college of business;university of iowa tippie college of business ranking;university of iowa tippie acceptance rate;university of iowa tippie college of business logo;university of iowa tippie school of business;university of iowa tippie requirements;university of iowa tippie tuition;university of iowa tippie college of business acceptance rate;university of iowa tippie college of business requirements;
University of Maryland Smith;North America;university of maryland smith school of business;university of maryland smith school of business ranking;university of maryland smith school of business acceptance rate;university of maryland smith mba;university of maryland smith school of business graduation 2023;university of maryland smith school career fair;university of maryland smith business;university of maryland clarice smith;university of maryland mba cost;university of maryland mba online
University of Massachusetts Amherst Isenberg;North America;university of massachusetts amherst isenberg;university of massachusetts amherst isenberg school of management;university of massachusetts amherst isenberg online mba;university of massachusetts amherst isenberg ranking;university of massachusetts amherst isenberg mba;average gpa for umass amherst isenberg;what is university of massachusetts amherst known for;is umass amherst prestigious;how large is umass amherst;
University of Michigan Ross;North America;university of michigan ross;university of michigan ross acceptance rate;university of michigan ross mba;university of michigan ross school of business ranking;university of michigan ross online mba;university of michigan ross application;university of michigan ross tuition;university of michigan ross transfer acceptance rate;university of michigan ross mba acceptance rate;university of michigan ross logo
University of Minnesota Carlson;North America;university of minnesota carlson school of management;university of minnesota carlson acceptance rate;university of minnesota carlson school of management ranking;university of minnesota carlson tuition;university of minnesota carlson school of management acceptance rate;university of minnesota carlson career fair;university of minnesota carlson study abroad;university of minnesota carlson school of business acceptance rate;university of minnesota carlson school of management study abroad;university of minnesota carlson graduation
University of North Carolina Kenan-Flagler;North America;university of north carolina kenan-flagler;university of north carolina kenan-flagler school of business;university of north carolina kenan-flagler online mba;university of north carolina kenan-flagler mba;university of north carolina--chapel hill (kenan-flagler) online mba cost;unc kenan flagler application deadline;kenan flagler application deadline;;;
University of Notre Dame Mendoza;North America;university of notre dame mendoza;university of notre dame mendoza college of business at chicago;university of notre dame mendoza college of business at chicago photos;university of notre dame mendoza ranking;university of notre dame mba;university of notre dame mba acceptance rate;university of notre dame mba fees;university of notre dame mba online;university of notre dame mba requirements;university of notre dame mba employment report
University of Oxford Saïd;Europe;;;;;;;;;;
University of Pennsylvania Wharton;North America;university of pennsylvania wharton;university of pennsylvania wharton acceptance rate;university of pennsylvania wharton mba fees;university of pennsylvania wharton mba;university of pennsylvania wharton address;university of pennsylvania wharton ranking;university of pennsylvania wharton school of business address;university of pennsylvania wharton mba requirements;university of pennsylvania wharton undergraduate acceptance rate;university of pennsylvania wharton undergraduate
University of Pittsburgh Katz;North America;university of pittsburgh katz graduate school of business;university of pittsburgh katz mba;university of pittsburgh katz ranking;university of pittsburgh katz faculty;difference between university of pittsburgh campuses;what is university of pittsburgh known for;what is the university of pittsburgh best known for;;;
University of Rochester Simon Business School;North America;university of rochester simon business school;university of rochester simon business school ranking;university of rochester simon business school acceptance rate;university of rochester simon business school fees;university of rochester simon business school mba;university of rochester simon business school academic calendar;;;;
University of San Diego School of Business;North America;university of san diego school of business;university of san diego school of business ranking;university of san diego school of business dean;university of san diego business school acceptance rate;university of san diego business school faculty;university of texas at san antonio - college of business;san diego state university school of business;university of san diego undergraduate business school ranking;business schools in san diego;does uc san diego have a business school
University of South Carolina Moore;North America;university of south carolina moore school of business;university of south carolina moore mba;university of south carolina moore school of business ranking;university of south carolina darla moore school of business scholarships;derrick moore university of south carolina;university of south carolina darla moore school of business faculty;dale moore university of south carolina;;;
